{
  "$schema": "../schemas/gcl_id_admission.schema.json",
  "schema_version": "1.0.0",
  "record_type": "GCL_STANDARD_ADMISSION",
  "operation_id": "GCL-ID-00-0.1.0-ADMISSION-001",
  "standard": "GCL-ID-00",
  "version": "0.1.0",
  "status": "admitted",
  "effective_condition": "protected_merge_of_this_exact_record",
  "reviewed_source": {
    "repository": "grandchallenge/gcl-standards",
    "candidate_head": "26425fbe30cfbef53cc31363486375290f8071c4",
    "protected_readback": "027d97d348573bdcd071c6ab82f2f54487261715",
    "standard_path": "standards/GCL-ID-00.md",
    "standard_git_blob_sha1": "4a7d5968bdbce38e6e462ed7c17a61ea6d5ca992"
  },
  "source_reviews": {
    "adversary": {
      "record_ref": "https://github.com/grandchallenge/gcl-standards/pull/89#pullrequestreview-5330008330",
      "logical_pass_id": "gcl-id-00-adversary-26425fbe-r1",
      "reviewer_system_id": "openai-gpt-5.6-sol",
      "candidate_head": "26425fbe30cfbef53cc31363486375290f8071c4",
      "finding": "approved"
    },
    "referee": {
      "record_ref": "https://github.com/grandchallenge/gcl-standards/pull/89#pullrequestreview-5330008397",
      "logical_pass_id": "gcl-id-00-referee-26425fbe-r1",
      "reviewer_system_id": "openai-gpt-5.6-sol",
      "candidate_head": "26425fbe30cfbef53cc31363486375290f8071c4",
      "finding": "approved"
    }
  },
  "protected_integration": {
    "base": "027d97d348573bdcd071c6ab82f2f54487261715",
    "required_checks": [
      "standards-policy",
      "policy / policy",
      "security / action-policy",
      "routing-enforcement"
    ],
    "requires_exact_head_logical_passes": true
  },
  "staffing_authority": {
    "repository": "grandchallenge/INTELLECT",
    "protected_anchor": "cacfe1f749b91a335e1d1734352cecff56bad7c1",
    "directive": "GI-STEWARD-0003",
    "work_class": "substantive",
    "effects": [
      "public_contract"
    ],
    "reserved_action_required": false,
    "human_steward_gate": "not_applicable_under_GI_STEWARD_0003"
  },
  "pilot_evidence": {
    "programme_repository": "grandchallenge/MATH-PROGRAMME",
    "work_package": "VGSE-ENG-WP06",
    "programme_substantive_merge": "9663a9bc8f71af808ea4578a02467cfd47c29d92",
    "programme_terminal_checkpoint": "f132000f8308c65ac89c31d90d5e22df6c5dc56c",
    "certification_repository": "grandchallenge/MATHCERT",
    "te3_audit_merge": "15b68c196d020045bea42fc34236e0647b87cbb9",
    "c05_reconciliation_merge": "ff8f2509d8d0603a2712abcc43c1d450136ee4b3"
  },
  "programme_adoption": {
    "required": true,
    "status": "not_yet_adopted",
    "repository": "grandchallenge/MATH-PROGRAMME"
  },
  "claim_boundaries": {
    "constitutional_authority_created": false,
    "organization_wide_conformance_authorized": false,
    "programme_adoption_complete": false,
    "mathematical_claim_authorized": false,
    "certification_claim_authorized": false,
    "agent_permission_escalation_authorized": false
  }
}
